{
  "campaign_id": "ret-orders-semantic-pr",
  "captured_at": "2026-08-09T12:06:00.635876Z",
  "ci": {
    "check_name": "semantic-dbt",
    "check_run_id": 93242055881,
    "completed_at": "2026-08-09T12:05:20Z",
    "conclusion": "success",
    "head_sha": "6c26af7c11d36a6d1cc55cba38701982c1e546e3",
    "validator_versions": {
      "dbt-core": "1.12.0",
      "dbt-duckdb": "1.10.1"
    },
    "workflow_run_id": 31312387660
  },
  "commit": {
    "changed_files": [
      "models/orders_model_00.sql",
      "tests/retirement_conductor/ret-orders-semantic-pr/02_parity-orders-model-output.sql"
    ],
    "head_sha": "6c26af7c11d36a6d1cc55cba38701982c1e546e3",
    "tree_digest": "sha256:3bfaa3cf806cf4d1cd7f213de1152d4ea115300ab4e7654a0359a7c8993099f4"
  },
  "native_validation": {
    "artifact_ids": [
      "sha256:0373de370b72a3b42a9cbd3b7992671e11b3c03d8eeea8ea04a581c96d626840",
      "sha256:1a11aa8d715a5988611bcb44017a576cb688039a82d989f25af85a0177d17257",
      "sha256:2fac7e0574aafdf3a69d2852da3e0a4e7b02c8b4b62f871bb5a7adaa643ab620",
      "sha256:40f81a949cb4bd7995cdc6e01bb92ea122e94b29e2b056cd027e8baa3a91d440",
      "sha256:4d812acd86905b57067905aa9a98628f0c9764d6c7f965eb8f6bf569d90b915b",
      "sha256:f8965f55ac975d666b2f15af8ad6edbfe099fa8750dc230c3a4c0cf2ef484124"
    ],
    "head_sha": "6c26af7c11d36a6d1cc55cba38701982c1e546e3",
    "result": "PASSED",
    "validation_digest": "sha256:54ea139dc1ee34596163a0f04eda6a23ccd33fa4431a0f6b5aaec571c4fdc729",
    "validator": "dbt parse + seed + build + test on DuckDB",
    "validator_version": "1.12.0"
  },
  "plan_digest": "sha256:1695c11f887e153c547dd29e14be572988e8426414f22aa367cd38d49c40ac95",
  "pull_request": {
    "base": "main",
    "changed_files": [
      "models/orders_model_00.sql",
      "tests/retirement_conductor/ret-orders-semantic-pr/02_parity-orders-model-output.sql"
    ],
    "head": "codex/ret-orders-semantic-pr",
    "head_sha": "6c26af7c11d36a6d1cc55cba38701982c1e546e3",
    "number": 1,
    "state": "OPEN",
    "url": "https://github.com/Arshgill01/retirement-conductor-semantic-pr-acceptance/pull/1"
  },
  "receipt_digest": "sha256:58973cee2fb6fe652740538edfa839bca5da70b040677d13c4a8cd73006ca1dc",
  "remote": {
    "name": "origin",
    "repository": "Arshgill01/retirement-conductor-semantic-pr-acceptance",
    "url_identity": "sha256:6f7cb2166c7409b2759e4d0da8dd61a61ee93943030714104725c8f021d71f31"
  },
  "schema_version": "1.0.0"
}
